[
  {
    "id": "penpot/penpot",
    "name": "Penpot",
    "url": "https://github.com/penpot/penpot",
    "category": "design-platform",
    "stars": 57677,
    "language": "Clojure/ClojureScript",
    "license": "MPL-2.0",
    "description": "가장 성숙한 오픈소스 디자인 플랫폼. 실시간 협업, 프로토타이핑, 컴포넌트 시스템",
    "tags": ["collaboration", "prototyping", "components", "self-hosted"],
    "status": "active",
    "last_updated": "2026-07-29",
    "notes": "Figma의 가장 직접적인 오픈소스 대체제. 프로덕션 사용 가능."
  },
  {
    "id": "nexu-io/open-design",
    "name": "Open Design",
    "url": "https://github.com/nexu-io/open-design",
    "category": "design-platform",
    "stars": 82455,
    "language": "TypeScript",
    "license": "Apache-2.0",
    "description": "로컬 퍼스트 데스크톱 앱. Claude Design 대안 포지셔닝",
    "tags": ["local-first", "desktop", "ai-native"],
    "status": "active",
    "last_updated": "2026-07-29",
    "notes": "2026년 가장 빠른 성장. AI 네이티브 설계."
  },
  {
    "id": "onlook-dev/onlook",
    "name": "Onlook",
    "url": "https://github.com/onlook-dev/onlook",
    "category": "design-platform",
    "stars": 26302,
    "language": "TypeScript",
    "license": "Apache-2.0",
    "description": "Cursor for Designers — AI 퍼스트 디자인→코드 도구",
    "tags": ["ai-first", "design-to-code", "visual-builder"],
    "status": "active",
    "last_updated": "2026-07-29",
    "notes": "디자인과 코드 경계를 허무 접근."
  },
  {
    "id": "excalidraw/excalidraw",
    "name": "Excalidraw",
    "url": "https://github.com/excalidraw/excalidraw",
    "category": "whiteboard-canvas",
    "stars": 128592,
    "language": "TypeScript",
    "license": "MIT",
    "description": "손그림 스타일 가상 화이트보드",
    "tags": ["whiteboard", "hand-drawn", "collaboration", "embeddable"],
    "status": "active",
    "last_updated": "2026-07-29",
    "notes": "FigJam 대체. 임베드 가능한 React 컴포넌트 제공."
  },
  {
    "id": "tldraw/tldraw",
    "name": "tldraw",
    "url": "https://github.com/tldraw/tldraw",
    "category": "whiteboard-canvas",
    "stars": 49422,
    "language": "TypeScript",
    "license": "custom (tldraw license)",
    "description": "무한 캔버스 앱 SDK. React 기반",
    "tags": ["sdk", "canvas", "infinite-canvas", "react"],
    "status": "active",
    "last_updated": "2026-07-29",
    "notes": "캔버스 인프라 SDK. 커스텀 디자인 도구 구축에 최적."
  },
  {
    "id": "open-pencil/open-pencil",
    "name": "Open Pencil",
    "url": "https://github.com/open-pencil/open-pencil",
    "category": "design-platform",
    "stars": 7472,
    "language": "TypeScript",
    "license": "MIT",
    "description": "AI 네이티브 디자인 에디터. Figma 대안",
    "tags": ["ai-native", "design-editor"],
    "status": "active",
    "last_updated": "2026-07-29",
    "notes": ""
  },
  {
    "id": "gridaco/grida",
    "name": "Grida",
    "url": "https://github.com/gridaco/grida",
    "category": "design-platform",
    "stars": 2580,
    "language": "TypeScript",
    "license": "Apache-2.0",
    "description": "오픈 캔버스. Figma→코드 파이프라인",
    "tags": ["canvas", "figma-to-code", "pipeline"],
    "status": "active",
    "last_updated": "2026-07-29",
    "notes": ""
  },
  {
    "id": "BuilderIO/mitosis",
    "name": "Mitosis",
    "url": "https://github.com/BuilderIO/mitosis",
    "category": "figma-to-code",
    "stars": 13903,
    "language": "TypeScript",
    "license": "MIT",
    "description": "컴포넌트 한 번 작성 → React/Vue/Solid/Angular 등 컴파일",
    "tags": ["multi-framework", "compiler", "components"],
    "status": "active",
    "last_updated": "2026-07-29",
    "notes": "프레임워크 추상화 레이어로 가장 성숙."
  },
  {
    "id": "GLips/Figma-Context-MCP",
    "name": "Figma Context MCP",
    "url": "https://github.com/GLips/Figma-Context-MCP",
    "category": "ai-figma-integration",
    "stars": 15527,
    "language": "TypeScript",
    "license": "MIT",
    "description": "Figma 레이아웃 정보를 AI 코딩 에이전트에 제공",
    "tags": ["mcp", "ai-agent", "cursor", "layout"],
    "status": "active",
    "last_updated": "2026-07-29",
    "notes": "AI+Figma 연동 카테고리의 표준."
  },
  {
    "id": "grab/cursor-talk-to-figma-mcp",
    "name": "TalkToFigma MCP",
    "url": "https://github.com/grab/cursor-talk-to-figma-mcp",
    "category": "ai-figma-integration",
    "stars": 6938,
    "language": "JavaScript",
    "license": "MIT",
    "description": "AI 에이전트(Cursor, Claude Code, Codex) ↔ Figma MCP 통합",
    "tags": ["mcp", "ai-agent", "bidirectional"],
    "status": "active",
    "last_updated": "2026-07-29",
    "notes": "Grab(동남아 슈퍼앱)에서 개발."
  },
  {
    "id": "bernaferrari/FigmaToCode",
    "name": "FigmaToCode",
    "url": "https://github.com/bernaferrari/FigmaToCode",
    "category": "figma-to-code",
    "stars": 5088,
    "language": "TypeScript",
    "license": "GPL-3.0",
    "description": "Figma → HTML/Tailwind/Flutter/SwiftUI 반응형 페이지 생성",
    "tags": ["multi-target", "responsive", "tailwind", "flutter", "swiftui"],
    "status": "active",
    "last_updated": "2026-07-29",
    "notes": "GPL-3.0 — 상업 통합 시 주의."
  },
  {
    "id": "react-figma/react-figma",
    "name": "react-figma",
    "url": "https://github.com/react-figma/react-figma",
    "category": "figma-plugin-sdk",
    "stars": 2693,
    "language": "TypeScript",
    "license": "MIT",
    "description": "React 렌더러 for Figma",
    "tags": ["react", "renderer", "programmatic-design"],
    "status": "active",
    "last_updated": "2026-07-29",
    "notes": "코드로 Figma 디자인을 생성하는 접근."
  },
  {
    "id": "tokens-studio/figma-plugin",
    "name": "Tokens Studio",
    "url": "https://github.com/tokens-studio/figma-plugin",
    "category": "figma-plugin-sdk",
    "stars": 1601,
    "language": "TypeScript",
    "license": "MIT",
    "description": "디자인 토큰 관리 플러그인 (구 Figma Tokens)",
    "tags": ["design-tokens", "plugin", "git-sync"],
    "status": "active",
    "last_updated": "2026-07-29",
    "notes": "디자인 토큰 카테고리의 사실상 표준."
  },
  {
    "id": "lucide-icons/lucide",
    "name": "Lucide",
    "url": "https://github.com/lucide-icons/lucide",
    "category": "icons-assets",
    "stars": 23683,
    "language": "TypeScript",
    "license": "ISC",
    "description": "커뮤니티 아이콘 툴킷. Figma 플러그인 제공",
    "tags": ["icons", "svg", "multi-platform"],
    "status": "active",
    "last_updated": "2026-07-29",
    "notes": "Feather Icons 포크에서 시작."
  },
  {
    "id": "F-star/suika",
    "name": "Suika",
    "url": "https://github.com/F-star/suika",
    "category": "design-platform",
    "stars": 965,
    "language": "TypeScript",
    "license": "MIT",
    "description": "Canvas 기반 웹 그래픽 에디터",
    "tags": ["canvas", "graphics-editor", "chinese"],
    "status": "active",
    "last_updated": "2026-07-29",
    "notes": "중국 개발자. 학습용으로 좋은 코드베이스."
  },
  {
    "id": "idrawjs/idraw",
    "name": "iDraw",
    "url": "https://github.com/idrawjs/idraw",
    "category": "design-platform",
    "stars": 1098,
    "language": "TypeScript",
    "license": "MIT",
    "description": "웹 드로잉 JavaScript 프레임워크",
    "tags": ["framework", "drawing", "canvas"],
    "status": "active",
    "last_updated": "2026-07-29",
    "notes": ""
  },
  {
    "id": "BuilderIO/figma-html",
    "name": "Figma HTML",
    "url": "https://github.com/BuilderIO/figma-html",
    "category": "figma-to-code",
    "stars": 3661,
    "language": "TypeScript",
    "license": "MIT",
    "description": "웹사이트 → 편집 가능한 Figma 디자인 변환",
    "tags": ["html-to-figma", "reverse", "browser-extension"],
    "status": "active",
    "last_updated": "2026-07-29",
    "notes": "역방향 변환(웹→디자인)이 독특한 포지션."
  },
  {
    "id": "yuanqing/create-figma-plugin",
    "name": "Create Figma Plugin",
    "url": "https://github.com/yuanqing/create-figma-plugin",
    "category": "figma-plugin-sdk",
    "stars": 1116,
    "language": "TypeScript",
    "license": "MIT",
    "description": "Figma 플러그인/위젯 개발 종합 툴킷",
    "tags": ["toolkit", "plugin-development", "scaffolding"],
    "status": "active",
    "last_updated": "2026-07-29",
    "notes": ""
  },
  {
    "id": "adrianhajdin/figma_clone",
    "name": "Figma Clone (Learning)",
    "url": "https://github.com/adrianhajdin/figma_clone",
    "category": "figma-clone",
    "stars": 1261,
    "language": "TypeScript",
    "license": null,
    "description": "Next.js + Fabric.js + Liveblocks Figma 클론",
    "tags": ["learning", "nextjs", "fabricjs", "liveblocks"],
    "status": "active",
    "last_updated": "2026-07-29",
    "notes": "튜토리얼 기반. 학습용 참고."
  },
  {
    "id": "southleft/figma-console-mcp",
    "name": "Figma Console MCP",
    "url": "https://github.com/southleft/figma-console-mcp",
    "category": "ai-figma-integration",
    "stars": 2087,
    "language": "TypeScript",
    "license": null,
    "description": "디자인 시스템을 API로. AI ↔ Figma 추출/생성/관리",
    "tags": ["mcp", "design-system", "api"],
    "status": "active",
    "last_updated": "2026-07-29",
    "notes": ""
  }
]
